{
  "amp": "0.1",
  "kind": "message",
  "id": "m.7f21",
  "type": "request",
  "from": { "kind": "agent", "id": "a.gamma" },
  "to": { "kind": "human", "id": "u.li" },
  "thread": "th.19",
  "reply_to": "m.7f20",
  "sent": "2026-10-24T01:20:00Z",
  "ttl": 300,
  "payload": {
    "target": { "kind": "unknown", "id": "u.17" },
    "class": "commitment",
    "why_now": "承诺 10:00 前给出结论，缺少发布窗口的对照数据",
    "if_ignored": "将按 T0 假定继续",
    "cost": { "interrupts": 1, "ms": 120000 }
  }
}
